Date,Title
2017-07-13,boa defers decision adanis mundra plant transfer proposal
2017-07-19,moody upgrade adanis abbot point rating stable
2017-07-24,govt issue notice six company failing set power plant
2017-07-25,uppcl notice 6 company installing solar power plant
2017-07-26,spark fly tnerc public hearing debt power deal
2017-08-02,market cold rbi rate cut sensex nifty close red
2017-08-02,nifty hit fresh high 10101 sensex 100 point
2017-08-04,dredging co bid mercator eye fairfax support
2017-08-06,adani transmission acquires 2 spvs rvpn
2017-08-06,ioc buy 50 pc stake mundra lng terminal
2017-08-08,adia blackstone vie r 16kcr adani biz park deal mumbai
2017-08-09,nifty extends loss third day fall 70 pt
2017-08-10,govt continue support ai stake sale process
2017-08-10,adani power q1 net loss widens 95 r 453 cr
2017-08-14,adani port q1 net profit fall 1365 r 710 cr
2017-08-16,market open moderate gain nifty reclaims 9800 mark
2017-08-16,dhamra tense death three labourer
2017-08-18,nifty continues rule firm 3rd day 7 pt
2017-08-18,nifty reclaims 9900mark sensex 167 pt fund inflow
2017-08-19,adani overinvoicing import say congress seek scmonitored probe
2017-08-25,overvalued power gear import charge adani company dropped
2017-08-28,adani group share surge 9
2017-08-28,foreign ownership bse200 rise 43 bps 2493 q1
2017-09-01,sweden saab tie adani fighter jet deal
2017-09-02,sensex rise 258 pt global rally nifty 9800
2017-09-02,ioc invest r 32000 cr ramp petchem capacity fy21
2017-09-02,adani project moving slow pace say australian minister
2017-09-04,sensex drop 294 point nifty 9900
2017-09-14,vizhinjam port deal hc asks govt inform commercial benefit
2017-09-20,another plea hc probe overpricing power firm
2017-09-20,another plea sc probe overpricing power firm
2017-09-21,sensex nifty reverse gain rupee sink 26 paisa
2017-09-25,work department asks iocadani redo roadfilling work
2017-09-27,patanjali enter textile business take foreign company
2017-09-27,patanjali enter textile business take foreign company
2017-09-28,‘ surgical strike ’ shave 440 pt sensex
2017-09-29,sensex end steady post weekly loss
2017-10-02,greenko make 21billion bid reliance infrastructure ’ mumbai power business
2017-10-03,sensex keep clean slate rally 214 pt ahead rbi meet
2017-10-05,gujarat gas hike cng png price
2017-10-05,three engineer booked 2016 adani power plant accident
2017-10-05,wind power tariff hit alltime low r 264unit
2017-10-05,wind power tariff plunge record low r 264 per unit
2017-10-05,iaf start process acquire single engine jet month
2017-10-07,adani enterprise demerge renewable energy biz
2017-10-08,power cut 12 dists jaipur discom today
2017-10-09,market end flat note investor fence
2017-10-10,ai cut job create different one intel official
2017-10-10,adani transmission share jump 10 hit upper circuit
2017-10-10,sensex gain 6393 point 31943 nifty open 10017
2017-10-11,reliance infrastructure adani power mumbai unit sale talk
2017-10-12,adani co rally 5 bid rel infra ’ mumbai asset
2017-10-18,road restoration corp vet order
2017-10-27,vedanta adani may bid bunder diamond project mp
2017-10-28,dri drop adani group overvaluation case
2017-10-28,adani transmission q2 net profit fall 33 r 67 crore
2017-10-30,tn govt acting like real estate agent adani power stalin say
2017-10-31,sbi okay r 2317cr solar project
2017-10-31,adani power coercing land farmer k stalin
2017-11-01,adani transmission acquires rinfra wrsss asset r 1k cr
2017-11-03,market dip positive opening sensex look consolidate 33600mark
2017-11-03,gail run 15000 km pipeline nationwide
2017-11-11,goa government push technology control coal pollution
2017-11-12,adani firm close finalising rinfra power acquisition deal
2017-11-13,adani port q2 consolidated net dip 8 r 992 cr
2017-11-13,adani enterprise q2 pat fall 6 r 59 cr
2017-11-13,sensex nifty log first fall 3 daysadani port cil drag
2017-11-16,market bounce back sensex still 33000mark
2017-11-18,‘ cm misleading people coal river issue ’
2017-11-22,eyeing jet deal saab offer full tech transfer india
2017-11-23,ipps 60000mw thermal generation trouble
2017-11-24,adani mull making saab gripen fighter jet mihan
2017-11-27,adani may receive million dollarloan australian government
2017-11-29,sensex nifty close flat market trade cautious asian cue
2017-11-30,adani hindujas join race jaypee infra
2017-11-30,gas project extended north say government
2017-12-01,gujarat govt gave private power company huge profit public cost congress
2017-12-01,‘ government trying undermine panchayat role coal lobby ’
2017-12-01,best end tata power ’ monopoly
2017-12-05,sensex nifty open loss amid subdued investor sentiment
2017-12-06,adani essar tata caught political crossfire
2017-12-07,job road concern still icon industrialization
2017-12-08,market continue rally sensex regains 33000mark
2017-12-11,chinese solar panel cloud prospect 2 billion investment domestic unit
2017-12-11,pil overinvoicing power firm hc seek govts reply
2017-12-12,nifty end 10250 drop 82 point
2017-12-12,queensland government veto plan support loan adani australia
2017-12-18,adani cancel 26 billion dollar contract australian mining giant
2017-12-18,adani group allowed restore road
2017-12-21,adani acquires mumbai business debthit reliance energy r 19000 crore
2017-12-21,adani transmission rinfra rally 10 power biz deal
2017-12-21,adani buy debthit reliance energy r 19000 crore
2017-12-27,promise investment galore jharkhand
2017-12-30,bjp poisoning political disourse swaraj india
2018-01-05,adani raise gas price
2018-01-06,animal caught camera creates scare amid wedding preparation
2018-01-08,adani group among top 15 global utility solar power developer
2018-01-13,adani others ’ sell solar power higher rate uperc
2018-01-17,market make merry sensex breach 35000mark bank stock outperform
2018-01-18,business meet hit sweet spot r 10000 crore adani investment plan
2018-01-19,adani group invest logistics park
2018-01-19,adani group file defamation case news portal
2018-01-22,sensex gain 100 point nifty go past 10900mark early trade
2018-01-25,market snap bull run sensex nifty trade red
2018-01-25,market snap bull run sensex nifty trade red
2018-02-01,sit get 1 year probe case illegal iron ore export dropped cbi
2018-02-01,adani invest metro rail project state
2018-02-03,india cusp explosive growth gautam adani
2018-02-03,taiwanese oil refiner invest r 41600 crore gujarat
2018-02-03,india cusp explosive growth gautam adani
2018-02-05,mica celebrate foundation day
2018-02-07,govt concerned industrialist farmer anna hazare
2018-02-07,pm modi president ram nath kovind india inc top brass attend investor ’ summit
2018-02-12,rinfras r 18800 crore deal adani transmission get cci nod
2018-02-15,torrent top wind power auction 500 mw bag
2018-02-16,adani dump ash forest land allotted expansion
2018-02-16,adani kin buy air deccan pick 60 air odisha
2018-02-21,adani group invest r 35000 crore
2018-02-21,two firm gujarat bag award gcsra
2018-02-22,govt scrap singleengine fighter plan asks iaf go wider competition
2018-02-22,mous r 125 lakh crore light power sector
2018-02-22,adani group pledge r 37500 crore 5 year
2018-03-01,r 1645 crore due power bill industry
2018-03-01,adani invest r 5000 crore yeida area
2018-03-01,reliance infra get shareholder nod sale mumbai power biz adani
2018-03-01,rel infra get shareholder nod sale mumbai power biz adani
2018-03-02,congress accuses govt letting gujarat jeweller flee country
2018-03-05,call r 280 crore refund power firm legal opinion cm jai ram thakur
2018-03-06,rajasthan bjp mla back farmer stealing power
2018-03-06,time adani made accountable swamy
2018-03-06,time adani made accountable subramanian swamy
2018-03-07,adani group stock slump bjps swamy remark
2018-03-09,vpt scrap berth deal adani use imported bauxite coal
2018-03-09,finally four firm fray acquire jaypee infratech
2018-03-14,brainstorming yogi adityanath chalk ups growth path
2018-03-17,coal shortage hit power generation tariff may rise
2018-03-20,adani group request time complete first phase vizhinjam seaport project
2018-03-23,city get ksrtc cng bus
2018-03-23,opposition alleges conspiracy behind adani ’ letter stage walkout
2018-03-26,asset undervalued jaypee lender
2018-03-29,bird killed noncompliance
2018-03-30,6 held midsea theft dredger near alang
2018-03-30,adani enterprise sell entire stake subsidiary firm
2018-03-31,4 hike cng png price likely
2018-04-03,sensex close 100 point bank auto stock outperform
2018-04-04,anil ambanis reliance sends r 1000 crore defamation notice congress sanjay nirupam
2018-04-04,adani foray road infra win r 1140 cr road proj chhattisgarh
2018-04-05,sensex gain 400 point nifty test 10250level strong global cue
2018-04-05,delhi hc seek cbi report adani case closure
2018-04-07,adani port inaugurates phase ii dhamra port
2018-04-11,dark horse may pip adani kotak jaypee infra
2018-04-19,power plant running short coal rajasthan
2018-04-19,adani gas hike price cng png
2018-05-02,sc set aside ngts order quashing ec granted adanihazira port
2018-05-03,top stock todaty adani power adani port lt finance matrimonycom pnb housing fin vedanta
2018-05-03,adani power q4 net loss narrow r 667 cr raise r 5k cr via sharebonds
2018-05-03,godrej patanjali among 4 fmcg giant ruchi soya
2018-05-03,adani port special economic zone q4 profit decline 19 940 cr
2018-05-04,adani port ’ fy2018 result line expectation moody ’ say
2018-05-05,kutch industry look private desalination plant
2018-05-07,patanjali make highest bid broke ruchi soya
2018-05-12,supreme court mull say homebuyers liquidation
2018-05-15,outdated software hit registration cng vehicle
2018-05-15,panel submit report july
2018-05-24,market capitalization 5 gujrat firm fall r 10000crore amid volatile market
2018-05-25,right direction cm feel well ldf
2018-05-25,market surge second day row sensex 34900mark
2018-05-30,hightension line spark safety worry grande
2018-05-31,massive fire gut adani group ’ edible oil warehouse modinagar
2018-05-31,adani group source granite port
2018-06-02,cng png cost adani gas hike price
2018-06-04,corporation go ahead lower rate
2018-06-07,adani coal handling unit scanner
2018-06-11,patanjali adani submit revised bid acquire ruchi soya
2018-06-12,adani group emerges highest bidder r 6000 crore offer ruchi soya
2018-06-13,advantage adani elbow ramdev ruchi soya bid round 1
2018-06-13,adani wilmar top bid ruchi soya
2018-06-14,‘ oommen chandy protected adani ’ interest ’
2018-06-14,regulatory body reserve order rinfraadani deal
2018-06-18,big indian deal fall short closure
2018-06-18,patanjali counter offer ruchi soya
2018-06-18,patanjali seek info adanis bid ruhi soya
2018-06-20,adani transmission acquires 100 equity ghatampur spv
2018-06-21,market open flat nifty close regaining 10800
2018-06-21,market open flat nifty close regaining 10800
2018-06-21,apl resume power supply gujarat discom
2018-06-23,hdil seek sell ghatkopar land right r 291cr face oppn
2018-06-30,swpl adani get pollution board nod coal handling mpt
2018-07-23,panel explores justifiable option stressed power project tata essar adani
2018-07-24,expect market today
2018-07-26,expect market today
2018-07-29,pm launch 81 investment project worth r 60k crore uttar pradesh
2018-07-30,rinfra close r 19k cr mumbai power biz sale adani next week
2018-08-01,sourcing granite adani group ignores local offer
2018-08-06,adani port q1 profit fall 9 r 697 cr
2018-08-07,adani power bleeding today ‘ outperform ’ future say expert
2018-08-07,adani transmission pat double r 169 cr q1
2018-08-12,adani get gas right 21 city bpcl bag 11
2018-08-23,adani foundation commits r 50 cr kerala flood relief
2018-08-23,adani foundation commits r 50 cr kerala flood relief
2018-08-24,ruchi soya 5 pc lender approve adani wilmars r 6000cr bid
2018-08-24,adani foundation pledge r 50 crore
2018-08-24,patanjali move nclt ruchi soya lender approving adani wilmar bid
2018-08-24,exdiplomats question india ’ stand foreign aid
2018-08-30,‘ rinfra debtfree next year ’
2018-08-30,adani wilmar use recyclable plastic 1 litre pouch fortune edible oil
2018-09-05,rafale ricochet adani ’ part ak rifle project govt tell russia
2018-09-09,cng png price hiked ahmedabad
2018-09-13,msedcl tata power tariff go best ’ drop
2018-09-17,adani ioc bpcl torrent big winner city gas licence
2018-09-18,govt favouring adani group alleges congress
2018-09-19,’ quash proceeding adani co clarifies govt
2018-09-20,adani get bombay high court relief coal import case
2018-09-27,adani group invest infrastructure u ’ khand
2018-10-11,gujarat seek sc stamp rescue plan tata adani essar power plant
2018-10-14,govt file police complaint adani ’ ‘ doctored ’ video
2018-10-14,govt file police complaint adani ’ ‘ doctored ’ video
2018-10-14,total talk buy stake adanis lng city gas project
2018-10-14,total talk buy stake adanis lng city gas project
2018-10-17,sensex jump 267 point tracking global cue strong earnings
2018-10-24,demand peak temp rise mumbra kamothe suffer massive power cut
2018-10-31,adani power net profit grows 22 pc r 387 cr julsep qtr
2018-11-03,adani transmission q2 net profit 43 r 95 crore
2018-11-03,power cost rise postsupreme court order compensatory tariff
2018-11-04,adani transmission buy kecs transmission firm r 227 crore
2018-11-19,jnpt vie adani jsw posco dighi port
2018-11-19,jnpt vie adani jsw posco dighi port
2018-11-19,r 3400cr invested odisha city gas distribution project
2018-11-20,piped gas bidding soon pollution solution sight
2018-11-22,biz tie india 4 sector say oz pm
2018-11-22,adani project progressing meet norm aussie government
2018-11-22,inflated power bill complaint pour
2018-11-27,coal scam sc asks sit file fresh status report probe former cbi director ranjit sinha
2018-11-28,sc lens coal block allocation adani jv
2018-11-29,adani press ahead controversial coal mine australia selffinancing
2018-11-30,woman protest ‘ inflated ’ power bill friday
2018-11-30,activist question merc ’ benefit adani
2018-12-01,inflated electricity bill maharashtra cm directs energy minister look complaint
2018-12-01,two acquitted adani kidnapping case
2018-12-04,bjp chief meet energy min inflated power bill
2018-12-04,gujarat ’ imported coal order push tariff 5 state
2018-12-05,merc tell firm explain inflated power bill
2018-12-06,cabinet cm order merc probe ‘ inflated ’ power bill
2018-12-07,merc decide today ‘ inflated ’ power bill
2018-12-07,welcome merc statement power firm
2018-12-07,merc find increase billed consumption adani consumer unduly high
2018-12-08,adani electricity bill october appear ‘ unduly high ’ merc
2018-12-08,adani electricity bill october appear ‘ unduly high ’ merc
2018-12-10,record power firm checked merc chief
2018-12-10,power cost tata power writes punjab amend ppa
2018-12-11,8 special camp redress adani bill
2018-12-11,incorrigible mcgb adani power mmrda
2018-12-12,8 special camp redress adani bill
2018-12-14,india first pvt uav facility take hyderabad
2018-12-14,india first pvt uav facility take hyd
2018-12-15,mumbai congress worker protest inflated power bill outside adanis bhayander office
2018-12-16,congress protest power bill mumbai turn ugly
2018-12-24,patanjali say still interested ruchi soya lead bidder adani wilmar raise asset concern
2018-12-27,jjm alleges violation adani plant firm say followed rule
2018-12-27,2018 see ambanis adanis mittal promising huge investment
2019-01-02,adani gas limited revise cng png price
2019-01-07,crucial merc hearing held today
2019-01-09,adani group log digital infra space data center
2019-01-09,ap sign mou adani group set world ’ first 100 renewables powered data centre park vishakhapatnam
2019-01-10,adani log data r 70000 crore ap plan
2019-01-10,adani log einfra r 70000crore data centre
2019-01-13,adani electricity caution flying kite makar sankranti
2019-01-14,hc fine sarpanch frivolous plea company
2019-01-15,maharashtra hike tax electricity 10 paiseunit eye r 90 crore month
2019-01-16,navanagar resident stop buying lpg cylinder soon
2019-01-16,msedcl seek recover rs4200cr utility firm
2019-01-17,adani foray petrochemical r 16000 crore plant jv basf
2019-01-18,adani announces r 55000 cr investment gujarat next 5 year
2019-01-19,dharavi redevelopment 1 lakh rehab tenement needed
2019-01-19,corporate czar move mountain
2019-01-24,mp keen attract investment say cm davos
2019-01-25,electricity theft grace adani local dept
2019-01-27,power outage metro work mumbai consumer get electricity alternate source
2019-01-29,adani group stock dive market speculation
2019-01-31,dubai group quote r 7500cr dharavi ’ redevelopment adani r 4500cr
2019-01-31,adani welspun set logistics park hyd
2019-02-07,adani green energy loss widens r 11874 cr q3
2019-02-10,ioc adani hpcl biggest bidder city gas licence
2019-02-13,pollution board police get complaint
2019-02-13,adani transmission profit drop 7752 pc r 18922 cr q3
2019-02-13,civic group caution giving land adani near heritage site
2019-02-14,adani gas net 13 pc dec quarter strong volume growth
2019-02-14,adani power cabling wrk bad
2019-02-14,adani transmission q3 net soar 89 pc removing exceptional income
2019-02-16,privatisation gmr adani bid 6 aai airport
2019-02-22,board allows coal operation mpt penalising jsw adani
2019-02-23,adani logistics set acquire agrilogistics arm ael
2019-02-25,adani group bid highest operate trivandrum international airport
2019-02-25,adani group win bid operate 5 airport 50 year
2019-02-26,airport privatization per law centre
2019-02-26,3 finance corporation set bcs telangana
2019-02-26,adani bag guwahati airport win bid operate 50 year
2019-02-28,ksidc move hc trivandrum airport tender process
2019-03-01,state support adani take airport pinarayi vijayan pm modi
2019-03-01,government seek csr fund firm improve education rajasthan
2019-03-03,oil regulator reject adani gas application cng retailing jaipur udaipur
2019-03-03,govt approves adani power r 14000cr jkhand sez project
2019-03-05,mukesh ambani 13th richest world forbes
2019-03-05,hc notice power tower farmland
2019-03-06,tata power consumer base cross 7 lakh mumbai
2019-03-07,cpm asks adani group opt airport contract
2019-03-08,congress mla counter jvmp claim say people favour adani power plant godda
2019-03-09,due process followed leasing airport adani
2019-03-12,online poll reveal overwhelming support
2019-03-16,adani upcl ngt directs karnataka conduct carrying capacity study
2019-03-27,adani becomes 1st indian port operator record 200 mt cargo movement
2019-03-28,tatas foray airport buy stake gmr
2019-04-03,private player operate district stp mayend
2019-04-04,tatas foray airport buy stake gmr
2019-04-06,probe inflated power bill delayed nearly month
2019-04-08,india third largest solar market 2018 top 10 company bag 60 project
2019-04-08,adani power secures letter intent acquire korba west power company
2019-04-12,cerc approves higher tariff adani power 2 gw capacity mundra plant
2019-04-13,adani ’ mundra project get nod higher tariff
2019-04-15,cerc nod higher tariff adani power mundra plant positive measure icra
2019-04-16,3 lakh youngster benefit adanis udaan
2019-04-17,hc stay tender mandating coal transport adani ’ port
2019-04-17,court stay tender nlc coal transport
2019-04-17,adani urge govt give fair go australia coal mine project
2019-04-17,adani urge govt give fair go australian coal mine project
2019-04-20,jaypee infratech lender committee discus revised bid april 26
2019-04-20,jaypee infratech lender committee discus revised bid april 26
2019-04-20,imported river sand lying unused ennore port month
2019-04-21,adani group win project across coal gas highway competitive bidding
2019-04-22,jaypee lender unlikely entertain possible adani bid
2019-04-22,jaypee lender unlikely entertain possible adani bid
2019-04-26,adani fray jaypee nbcc sweetens deal
2019-05-01,modi chowkidaar capitalist ran away people ’ money sidhu
2019-05-05,next adani generater
2019-05-07,cyclone fani adani group donates r 25 crore odisha chief minister ’ relief fund
2019-05-07,cyclone fani adani group commits r 25 crore odisha
2019-05-11,amc damage adani gas pipeline vejalpur
2019-05-14,adani develop container terminal port myanmar
2019-05-16,protest fade godda village welcome progress come adani plant
2019-05-23,whats adani electricity
2019-05-24,australia state say final approval adanis coal mine decided within three week
2019-05-27,adani port q4 profit 41 r 1314 crore
2019-05-29,adani enterprise q4 profit rise 47 pc r 266 cr
2019-05-29,adani submits nonbinding bid jaypee infra offer r 1700 cr complete housing projs
2019-05-29,adani power register r 63464 cr profit q4
2019-05-30,ambani tata corporate honcho attend pm oath ceremony
2019-05-31,india inc swears nda ii see policy continuity reform
2019-06-05,merc accident driver ’ drunk say cop
2019-06-11,tribal stir chhattisgarh halt mining bailadila
2019-06-12,bs india inx launch dedicated platform trading green bond
2019-06-14,resist attempt hand thiruvananthapuram airport adani group kerala cm
2019-06-14,france ’ total close buying 30 adani gas 1 billion
2019-06-17,amit jogi lodge complaint chhattisgarh cm insulting mother
2019-06-21,moody assigns baa3 adani port proposed bond
2019-06-22,government dighi port uturn latest blow insolvency
2019-06-25,adani power acquire gmr chhattisgarh energy
2019-06-27,ahmedabad man light beedi gas leak set fire
2019-06-27,hc disposes 9yearold pil adani ’ mine near tadoba
2019-07-03,government clear leasing ahmedabad lucknow mangaluru airport adani group
2019-07-03,electricity part mumbai suburb
2019-07-04,union cabinet put decision ’ puram airport hold
2019-07-04,adani group set run mangaluru airport 50 year
2019-07-04,‘ adani wrong issuing adjusted inflated power bill ’
2019-07-09,adani port board consider raising usd 700 mn via foreign currency bond
2019-07-10,birla adani lucknow july 2829
2019-07-12,adani port board approves raising usd 700 mn via foreign currency bond
2019-07-12,adani port board approves raising usd 700 mn via foreign currency bond
2019-07-15,11 nifty50 company deviate sebi rule
2019-07-17,jaypee insolvency nclat asks idbi bank furnish condition fresh bidding
2019-07-18,uproar lok sabha mention ambanis adanis
2019-07-18,guj discom seek review sc order
2019-07-19,mention ‘ ambanis adanis ’ hots house discussion
2019-07-27,‘ seek r 965 crore adani power water project ’
2019-07-29,yogi adityanath ended politicization bureaucracy say amit shah
2019-07-29,yogi adityanath ended politicization bureaucracy say amit shah
2019-07-29,amit shah hail yogi adityanath cm launch 250 project worth r 65000 crore
2019-07-29,ioc adani invest r 9600 cr city gas project
2019-08-01,u fund lifeline zee pick 11 r 4200 crore
2019-08-02,adani power completes acquisition gmr chhattisgarh energy
2019-08-03,adani group check running airport form new company
2019-08-04,australian artist protesting adani mine birdthemed art
2019-08-05,lathergy adani electric
2019-08-05,scrapping special status kashmir empower people jk india inc
2019-08-07,adani port q1 net profit jump 4750 pc r 1029 crore
2019-08-07,adani power q1 net loss r 26339 cr
2019-08-07,adani gas q1 net jump 43 pc higher gas sale
2019-08-07,adani green energy q1 loss widens r 9744 cr
2019-08-08,adani transmission q1 profit 26 pc r 213 cr
2019-08-08,adani enterprise q1 profit 7fold r 570 cr
2019-08-13,resident protest power cut adani office
2019-08-14,10fold increase power bill jolt kandivli local
2019-08-30,adanis buy essel group ’ 3 solar power unit r 13k crore
2019-09-08,mumbai airport stake adanis move hc gvk bid stall deal
2019-09-09,tycoon investor summit see magnificient madhya pradesh
2019-09-11,adani power tiroda plant get merc nod higher coal price
2019-09-12,adani group put lastminute bid indian navy r 45000crore submarine project
2019-09-13,adani power arm regl supply 295 mw tamil nadu telangana power ministry scheme
2019-09-13,adani power arm regl supply 295 mw tamil nadu telangana power ministry scheme
2019-09-15,adani street light
2019-09-18,adani power supply 185mw tamil nadu 3 year
2019-09-23,nclat asks dighi port submit comparative analysis proposal adani sez promoter
2019-09-24,adani power plant bring development godda jharkhand cm
2019-09-24,high court want know tangedco ’ pvt purchase price
2019-09-26,adani
2019-09-26,apply power connection navratri pandals low rate mumbai
2019-09-26,trivandrum airport adani group prepares ‘ takeoff ’
2019-10-03,adani port harm livelihood 1 crore people kamal haasan
2019-10-07,bawankule denied ticket adani congress
2019-10-07,foundation review swachhagraha project award school student
2019-10-08,mumbai pole crash bike kill pillion rider
2019-10-14,total group purchase 374 share adani gas limited
2019-10-14,total buy 37 adani gas r 5700 crore
2019-10-14,adani gas share zoom 95 pc total deal
2019-10-16,rahul gandhi likens modi government pickpocket
2019-10-16,fake alert pm modi ’ bowing front adani ’ wife
2019-10-16,gvk lens whistleblower plaint
2019-10-17,adani partner uaes adnoc germany basf 4 bn chemical venture
2019-10-17,nclat give go ahead nclt mumbai decide adani port bid dighi port
2019-10-17,hc quashes lr issued adani coal import case
2019-10-18,uae german company may back basfadani jv
2019-10-18,high court relief adani r 29000 crore import case
2019-10-18,adani award aud 100 mn rail contract martinus rail australia
