Date,Title
2019-10-19,business bigwig chirp indores swachhta social medium
2019-10-27,happy diwali gvk group secures r 7614 crore funding prevent takeover adani group
2019-10-29,adani group partner usbased digital realty build data centre infra india
2019-10-30,adani tie u company data centre
2019-11-01,adani port sez get national csr award
2019-11-05,mial stake row adani seek hc nod close bidvest deal
2019-11-06,battle stake mumbai airport hc refuse interim relief adani
2019-11-07,adani transmission see twofold jump q2 net profit r 230 cr
2019-11-07,adani dial final 4 jewar airport race
2019-11-07,mumbai airport hc refuse relief adani company
2019-11-10,100 indian ceo deepika padukone visit davos 50th wef annual meet
2019-11-11,adani port q2 result today
2019-11-12,adani gas q2 net double r 120 cr
2019-11-13,adani power net profit nosedive r 388 cr sept quarter
2019-11-14,cci approves adanis 235 pc stakebuy mumbai international airport
2019-11-15,community member raise r 45 crore last rite gachchadhipati
2019-11-17,essar steel adani gail hpcl buy bulk reliance gas
2019-11-18,ioc gail pay adani 5 charge lng terminal dharmendra pradhan
2019-11-28,cci approves 374 stakebuy joint control adani gas total group
2019-11-29,adani gas share zoom nearly 8 pc cci approves stakebuy total group
2019-11-29,swiss firm zurich airport ag develop jewar airport outbids dial adani
2019-11-29,new world fund sell adani port share worth r 401 cr
2019-11-30,zurich ag outbids adani dial jewar airport
2019-12-02,major ‘ make india ’ defence project taken 6 yr
2019-12-11,qatar sovereign wealth fund qia buy 251 pc stake adani electricity mumbai r 3200 cr
2019-12-12,qatar fund buy 25 adani electricity r 3200 crore
2019-12-14,adani transmission get loi project maharashtra
2019-12-17,government talking 25 large corporates bid resolve problem boost investment
2019-12-18,leasing trivandrum airport hc dismisses kerala govts plea
2019-12-19,thanks adani electricity
2019-12-19,hc dismisses state govt ’ plea tvm airport
2020-01-07,ahead budget pm modi pick business baron brain slump
2020-01-08,supreme court revives overseas probe gautam adani ’ firm
2020-01-08,supreme court revives overseas probe gautam adani ’ firm
2020-01-11,sc stay hc order dri letter
2020-01-11,5year power tariff home user best tata seek hike adani cut
2020-01-11,hc relief adanis stockrigging case
2020-01-12,sailing forward handle 400 mmt cargo 2025
2020-01-14,navy ministry defence tussle biggest submarine project
2020-01-16,congress govt favouring adani group r 45000 crore sub deal
2020-01-17,cbi file fir adani firm coalsupply case
2020-01-19,donald trump angela merkel imran khan attend wef davos 100 indian ceo also present
2020-01-23,adani aim world ’ largest solar co 2025
2020-01-24,kerala new outlet give push cng vehicle
2020-01-24,district administration crack whip ioagpl expedite work
2020-01-31,tmaadani honour startup company
2020-02-09,gautam adani meet naveen patnaik talk dhamra port expansion
2020-02-14,adani group sign agreement aai running ahmedabad lucknow mangaluru airport 50 year
2020-02-15,ahmedabad sport club buy 60000 square yard land adani kin firm
2020-02-18,adani electricity cable layer need training
2020-02-21,adani vidya mandir ahmedabad surguja conferred samagra shiksha empowering india award
2020-02-21,adani vidya mandirs win samagra shiksha award
2020-02-25,student 2000 school sensitised electricity safety cleanliness
2020-03-05,ahmedabad physician beat oncologist wife phone use
2020-03-15,aipef demand cancellation ppa adani mp
2020-03-19,jharkhand 5 chinese engineer set join work 28day quarantine
2020-03-21,covid19 adani electricity facilitates digital payment mode encourages customer stay indoors
2020-03-30,adani sajjan jindal pledge r 100 crore kotak r 60 crore
2020-04-04,ahmedabad gautam adani employee contribute r 4 crore pm fund
2020-04-08,tata steel adani donate r 11 crore cm relief fund
2020-04-09,adani gas limited gujarat gas limited reduce cng png price
2020-04-09,adani foundation aid woman shgs making mask
2020-04-10,adani wilmar tie swiggy deliver edible oil food product
2020-04-11,cooking oil production 40 adani wilmar
2020-04-12,maharashtra discoms turn energy exchange shun costly ppas
2020-04-15,gautam adani say indian economy bounce back low inflicted covid19
2020-04-15,covid19 helped rediscover hope goodness
2020-04-16,mumbai adani electricity supply power emergency basis quarantine area
2020-04-20,got chance spend time family many year deepak punia
2020-05-17,crisishit airline save r 1000 crore govt free airspace
2020-05-28,gautam adani see covid19 opportunity faster transition clean energy
2020-06-03,cyclone nisarga power cut likely today due forced shutdown mumbai
2020-06-04,india couldve faced unmitigated disaster govt taken timely action covid19 adani
2020-06-06,iimb host webinar communication virtual world
2020-06-07,better time bet india say billionaire gautam adani
2020-06-08,adani green energy win world largest solar bid worth 6 billion
2020-06-09,gautam adani say promoter dilute 1015 stake adani green
2020-06-10,promoter dilute 1015 adani green
2020-06-12,igi operator told give revised tariff projection
2020-06-18,collector asks oil firm expedite kochi gas project
2020-06-18,mumbai brace spike power bill reading start
2020-06-19,mumbai june electricity bill amount recovered three equated instalment say power expert
2020-06-23,adani offer r 3265 crore take power co pvt
2020-06-23,adani power sign pact buy 49 stake aes odisha power generation corporation
2020-06-23,postcovid19 billionaire list poonawalla gain ambani bounce back
2020-06-23,mumbai region power user feel heat ‘ inflated ’ bill
2020-06-24,adani power sign pact buy aes ’ 49 stake opgc
2020-06-25,mumbai region electricity consumer irked emi option given pay inflated bill
2020-06-25,prasanna karthika nair complains heavy eb bill covid19 lockdown
2020-06-26,adani electricity charged 3 timesof bill
2020-06-27,adani bag transmission deal boost supply mumbai
2020-06-27,adani green energy get shareholder nod raise r 2500 crore
2020-06-28,taapsee latest complain steep eb bill lockdown
2020-06-30,netizens kickstart memefest social medium bollywood twist inflated electricity bill
2020-07-02,adani start video call resolve power bill issue
2020-07-02,mumbai adani electricity start video call hear bill woe
2020-07-03,bombay hc defers two pil high power bill another bench next hearing tuesday
2020-07-04,commercial space chandigarh railway station time given bidding
2020-07-04,gujarat adani build infra hazira restart roro ferry service
2020-07-06,railway seek make private player journey smoother
2020-07-07,50 use power led hefty bill adani ceo
2020-07-07,adanis buy kalpataru ’ power project
2020-07-07,highly inflated adani electricity bill
2020-07-10,india good example solar auction gain popularity amid covid19 pandemic un chief
2020-07-10,adani offer zerointerest emi ‘ inflated ’ electricity bill payment
2020-07-16,maharashtra aap demand waiver power bill upto 200 unit launch hisaab campaign
2020-07-20,higher tariff revocation reduce power rate gujarat government
2020-07-20,higher tariff revocation reduce power rate gujarat government
2020-07-21,privatisation jaipur airport postponed till march 2021
2020-07-22,bombardier gmr among 16 show interest private train
2020-07-27,mumbai bhajji left stumped r 34000 power bill
2020-08-01,mlas reach jaisalmer special fight
2020-08-04,adani group suraksha sunteck realty submit eoi acquire debtladen hdil
2020-08-10,baba ramdevs patanjali considers bidding ipl vivo retires short notice
2020-08-15,india selfreliance determine high flag freedom fly india inc
2020-08-18,mumbai power company float tender 7 lakh smart meter
2020-08-20,govt clear running jaipur guwahati ’ puram airport ppp way 50 year
2020-08-21,aai letter soon adani group operate jaipur airport
2020-08-21,kerala govt seek stay leasing trivandrum airport adani group
2020-08-21,adani group may face several hurdle ahead
2020-08-22,mial ownership structure likely change soon adani landing
2020-08-22,trivandrum international airport handover subject writ petition say hardeep puri
2020-08-22,leasing trivandrum airport kerala govt move hc
2020-08-23,law firm linked adani jr advised govt airport bid
2020-08-23,firm adani link aided kerala govt airport bid
2020-08-24,confidence motion kerala assembly airport bid amount leaked adani group say vd satheesan
2020-08-25,kerala congress level 3 new graft allegation
2020-08-25,warring front unite trivandrum airport cause
2020-08-31,adani group acquire 74 stake mumbai airport take upcoming navi mumbai airport also
2020-09-02,mumbai navi mumbai airport group transformational platform say gautam adani
2020-09-03,sc order discoms repay adani r 5k cr burden likely
2020-09-03,coronavirus hit travel adani ready india aviation growth
2020-09-04,ap okay adani acquisition krishnapatnam cvr group
2020-09-06,jharkhand couple drove 1200km write exam get air ticket return journey
2020-09-09,rajasthan hc order status quo adani solar project jaisalmer dist
2020-09-13,adani group likely review navi mumbai airport design
2020-09-13,privatisation trivandrum airport finance minister urge tharoor rethink position favouring adani group
2020-09-15,air india choice privatising closing say puri
2020-09-15,maharashtra adani takeover twin city airport clear hurdle embarrassment
2020-09-16,60000 cr debt air india close privatised puri
2020-09-16,flyfromixe campaign handled young aviation enthusiast namma kudla take
2020-09-17,kutch power world ’ largest park
2020-09-25,adani tata gmr among 43 firm show interest csmt redevelopment project railway
2020-09-26,adani tatas among 43 prebid meet csmts redevelopment
2020-09-28,gautam adani debunks gdp rhetoric say india 2nd largest economy 2050
2020-09-29,mukesh ambanis wealth shoot 73 r 658 lakh crore adani move net worth ranking
2020-09-29,adani wilmar expands range personal care product
2020-09-30,commercial mining vedanta adani hindalco jspl among 42 bidder coal block
2020-09-30,ahmedabad adani gear take sardar vallabhbhai patel international airport november
2020-10-02,‘ sim satyagraha ’ farmer punjab turning corporates
2020-10-02,kochi 6 household got png connection 5 yr
2020-10-04,pm modi work adani ambani say rahul gandhi
2020-10-08,jewar airport ’ guiding template swiss tech indian warmth
2020-10-08,adani group asked take ahmedabad lucknow mangaluru airport november 12
2020-10-13,mumbai power outage supply restored pocket experiencing cut due localised issue
2020-10-16,adani green transfer 3 solar asset total jv r 1632cr
2020-10-16,rebuilding mumbai airport ’ terminal 1b may adani ’ first task
2020-10-18,kochi local body speed procedure gas project
2020-10-19,hc dismisses kerala govts petition thiruvananthapuram airport lease adani group
2020-10-19,adani vikhroli substation ready maharashtra cm deadline
2020-10-20,government plea trivandrum airport dismissed
2020-10-22,adani group takeover ahmedabad lucknow mangaluru airport november 7
2020-10-23,dhfl ’ creditor may seek higher bid oaktree
2020-10-23,ahmedabad firm restrained using ‘ adani ’ trademark
2020-10-24,adani electricity offer nointerest emi option
2020-10-25,r 600crore data centre coming greater noida
2020-10-26,torture demand dowry male child
2020-10-27,discoms told study mumbai develop emergency grid
2020-10-31,adani group add new chapter business mangaluru international airport
2020-10-31,aai hand mangaluru airport adani group lease 50 year
2020-11-01,vedanta adani among others race coal block auctioned commercial mining mon
2020-11-01,mangaluru adani group take management mia
2020-11-02,reliance start gas production rseries field novemberdecember
2020-11-03,online campaign call renaming mangaluru international airport kotichennaya
2020-11-03,billionaire adani set develop sri lanka ’ port terminal
2020-11-04,council give nod dig road kochi gas project
2020-11-05,congress ups ante handing mangaluru airport adani group
2020-11-06,stake goa ’ road rail project say adani group
2020-11-06,congress ups ante handing mangaluru international airport adani group
2020-11-07,adani take ahmedabad airport run 50 year
2020-11-07,telangana ’ largest fdi r 20000 crore city delivered via amazon
2020-11-09,oil regulator give 251 day ioc adani gas others complete work
2020-11-10,mangaluru congress protest handing mia maintenance adani
2020-11-11,bidder hike dhfl offer oaktree ’ remains largest
2020-11-12,gujarat adani lead india ’ energy strategy say report
2020-11-12,diwali diwali gujarat company deliver big return
2020-11-19,adani guaranteed customer 6 billion indian solar project report
2020-11-19,chandigarh adani tata enter race power department privatisation
2020-11-19,karnataka ‘ pilinalike ’ get due prominence mangaluru international airport
2020-11-20,chandigarh better performance earn power firm incentive
2020-11-20,bravo adani electricity
2020-11-21,mumbai adani launch video contact centre plan smart meter
2020-11-21,coal protester demand sbi stop financing adani ’ australia project
2020-11-22,govt send proposal rename mangaluru airport kotichennaya dakshina kannada mp nalin kumar kateel
2020-11-25,adani data park develop potential
2020-11-28,nse turnover hit record r 15l cr msci ’ rejig
2020-11-29,defiant farmer threaten intensify protest reject centre condition top development
2020-11-30,improve dhfl offer forfeit deposit recovery public money adani
2020-12-02,rohatgi advises fresh bid dhfl
2020-12-08,‘ procorporate ’ farm law revoked tweet rahul gandhi
2020-12-08,bharat bandh today farmer hold protest across state key point
2020-12-09,adani group say buy food grain farmer manages storage fci
2020-12-09,india produce cheapest electricity renewable source gautam adani
2020-12-09,mumbai adani electricity give 30 subsidy energy saving fan 50000 home consumer
2020-12-10,energy saving fan 50000 adani user mumbai suburb
2020-12-10,india ’ gdp set hit 28tn ’ 50 adani
2020-12-11,farmer group blame centre interrupting talk process
2020-12-11,trade union support farmer agitation saying bharat bandh december 8 successful
2020-12-14,billionaire survivor ransom terror attack rival mukesh ambani
2020-12-15,usbased pe oaktree top dhfl bidder r 37000 crore
2020-12-15,iimbangalore student get 529 offer 130 company
2020-12-17,priyanka ’ claim railway ‘ misleading ’ clarifies govt
2020-12-21,bcci agm member serious question sourav ganguly bcci president enough answer
2020-12-21,flyer fume fog hit flight schedule lucknow airport
2020-12-22,gujarat 40 mbbs student 2020 passouts previous year
2020-12-24,bcci agm board capable right thing
2020-12-29,aai hand jaipur guwahati thiruvananthapuram airport adani group january
2020-12-30,aai adani group ink agreement
2020-12-30,jio seek punjab cm intervention safeguard telecom infra urge action miscreant
2021-01-01,adani green get 600mw windsolar hybrid power project seci
2021-01-01,closer safe harbour
2021-01-03,footfall jaipur airport plunge holiday season
2021-01-05,fortune cooking oil ad featuring sourav ganguly taken air temporarily
2021-01-05,adani wilmar stop ad featuring sourav ganguly suffers heart attack
2021-01-05,sourav ganguly continue brand ambassador adani wilmar dy ceo
2021-01-06,city gas project work kochi corporation limit start month
2021-01-07,ganguly leaf hospital oil brand heart healthy ad pulled
2021-01-09,punjab trade union protest support farmer
2021-01-12,makar sankranti adani electricity caution kiteflyers stay away transmission line mumbai
2021-01-15,exstaff nrc protest stop ‘ illegal ’ razing
2021-01-15,modi government want weaken fci help corporates navjot singh sidhu
2021-01-16,mumbai gmr adani godrej seven others bid r 1600 crore csmt revamp
2021-01-18,france total acquires 20 stake adani green energy
2021-01-18,adani group operated lucknow airport accredited safe travel
2021-01-18,two india richest men caught crossfire farming law
2021-01-19,flying covid amausi airport soar high top global safety tag
2021-01-19,adani group take jaipur guwahati thiruvananthapuram airport midjuly
2021-01-19,adani green sell 20 stake 50 solar project total
2021-01-20,mumbai adani electricity staff donate blood thalassemia sickle cell haemophilia patient
2021-01-21,‘ govt still airport transfer ’ kerala cm pinarayi vijayan
2021-01-21,rajasthan high court notice centre relief farmer
2021-01-24,gujarat govt ink mou adani port
2021-01-25,wealth amassed 100 richest indian pandemic give 138 crore poorest r 94k oxfam
2021-01-25,adanis half work problem
2021-01-29,gujarat ‘ hrct caught 50 asymptomatic covid case ’
2021-01-30,major port create roro infrastructure
2021-01-31,adani gas raise cng png price ggl hike rate
2021-02-01,fm hit back rahul gandhi crony capital comment budget
2021-02-02,gujarat marginal increase seen palm oil price
2021-02-03,pil challenge privatisation mangaluru airport
2021-02-04,gmr adani among 9 fray r 6500 crore new delhi railway station revamp
2021-02-04,haryana rera say project registered notice adani firm broker
2021-02-04,adani group bag 5 solar project ap
2021-02-04,gmr adani among 9 fray r 6500 cr new delhi station revamp
2021-02-05,govt nod incentive adani data centre
2021-02-05,help ntpc adani group ap bet big solar power
2021-02-07,conservation policy adani ’ turtlesaving plan take shape
2021-02-07,adani group check mumbai airport acquiring 235 stake way 74 ownership mial
2021-02-10,mumbai 31 renewable source power likely 2023 say adani ceo
2021-02-11,bengaluru hacker sriki stole data adani power pc say police
2021-02-16,adani port invest r 10000 crore develop dighi port
2021-02-24,noida adani get 9 acre phase 2 data centre
2021-02-24,hum humare rahul take dig renaming gujarat stadium name 2 end corporates
2021-02-26,punjab activist stop train outside adani group silo moga
2021-03-02,india add 40 billionaire pandemic year adani ambani see rise wealth report
2021-03-04,adani group buy stake gangavaram port ap
2021-03-05,lankas claim indian mission approval wct project proposal factually incorrect mea
2021-03-05,mumbai 4 dip electricity rate evehicle charging also cheaper
2021-03-08,warburg invest r 800cr adani port
2021-03-11,maharashtra mahavitarans record power supply 22339 mw tuesday without interruption
2021-03-12,power privatisation jerc okay td loss trajectory
2021-03-12,gautam adani beat elon musk jeff bezos biggest wealth surge
2021-03-13,struggling adanis wealth rise 50 asks rahul gandhi
2021-03-16,adani welspun strike gas mum offshore
2021-03-17,emami agrotech eye packaged soya market
2021-03-18,adani green tie 13 billion dozen bank
2021-03-19,global lender back adani solar plant 13 billion
2021-03-19,panneerselvam say adani port expansion plan kattupalli
2021-03-19,panneerselvam say adani port expansion plan kattupalli
2021-03-20,adani arm agel acquire 50 mw solar asset skypower global
2021-03-21,adani green acquire 50mw solar asset skypower
2021-03-23,33 power mumbai adani add 1000mw
2021-03-24,gangavaram port deal give adani 58 stake
2021-03-25,sp sell 2 solar plant adani r 446cr
2021-03-25,mumbai adani electricity appeal nearly 3 million power user observe earth hour
2021-03-25,world biggest wealth surge herald rise india next ambani
2021-03-26,mumbai adani appeal nearly 3 million power consumer observe earth hour saturday
2021-03-27,adani transmission acquire warorakurnool transmission r 33k crore
2021-03-28,adani acquire wktl r 3370 crore
2021-03-29,buzz pawarshah meet add spice maharashtra saga
2021-04-02,india push back deadline coalfired utility adopt new emission norm
2021-04-03,adani group benefit kseb ’ power purchase deal chennithala
2021-04-03,kerala state electricity board dismisses corruption claim
2021-04-04,reliancebp seek buyer 55 mmscmd gas kgd6
2021-04-04,‘ powerrich kerala buying unit adani ’
2021-04-05,kseb adani inked shortterm pact chennithala
2021-04-06,adani group becomes third indian conglomerate cross 100 billion mcap
2021-04-07,adani launch green energy initiative 3 million customer mumbai
2021-04-08,adani start green energy drive mumbai city
2021-04-12,walmart build massive india warehouse billionaire gautam adani
2021-04-13,adani port removed sp index due link myanmar military
2021-04-13,flipkart tie adani logistics data hub
2021-04-13,flipkart partner adani group data centre chennai
2021-04-13,adani commission 50 mw solar power plant chitrakoot
2021-04-14,adani enterprise 12 company get industrial land noida
2021-04-14,gujarat billiondollar club grows bigger 22
2021-04-14,adani port stock dip removal sp index
2021-04-18,mumbai youth killed hitandrun riding back home workplace
2021-04-19,agel unit bag 150mw torrent power project
2021-04-19,environment friendly transformer western suburb adani electricity
2021-04-25,covid19 saudi arabia ship 80 metric tonne oxygen india meet growing demand
2021-04-26,ahmedabad adani group join effort secure medical oxygen
2021-04-27,mumbai adani electricity train employ tribals make one lakh mask
2021-04-27,adani secures 12 cryogenic tank dubai
2021-04-28,coal plant insurance face green hurdle
2021-04-28,mumbai tribals hired stitch 1l mask
2021-05-01,adani group set covid care centre ahmedabad
2021-05-02,market guided covid19 situation macro data earnings week analyst
2021-05-05,cmdesignate stalin urged scrap chennaisalem expressway project allow reopening sterlite plant
2021-05-05,coup effect adani ready scrap plan myanmar
2021-05-07,mumbai 11hour power cut anger resident goregaon west
2021-05-08,india timber hub stare closure payment worth crore pile
2021-05-09,adani group procures 51 cryogenic oxygen tank ahmedabad
2021-05-10,sensex jump 296 point pharma stock surge
2021-05-12,gujarat top new wind power capacity
2021-05-12,pledged bse 500 stock ’ value shrink r 16 lakh crore
2021-05-17,adani green eye sb energy
2021-05-19,adani green buy sb energy green portfolio 35 billion valuation
2021-05-19,adani green buy softbankbacked sb energy 35 billion deal
2021-05-20,adani co buy sb energy ’ green biz 35 billion valuation
2021-05-21,gautam adani 67 billion asia ’ 2nd richest
2021-05-21,adani 67bn asia ’ 2nd richest
2021-05-22,ppp airport operator seek ‘ cash support ’ government pay staff sustain operation
2021-05-22,agel arm transfer 74 stake msel adani tradecom llp
2021-05-23,ut seek report progress power privatisation project
2021-06-03,tracing gspc ’ stake crash lng project
2021-06-04,ajp submits memorandum aai centre ’ decision handing airport adani group
2021-06-06,chhattisgarh auction 16 mine next three month cm bhupesh baghel pralhad joshi
2021-06-09,gujarat tally firm 5bnplus mcap 3 time since pandemic
2021-06-09,need relief urgently sustain operation private airport government
2021-06-11,43 billion jump adani ’ fortune fraught many risk
2021-06-12,mumbai first 7000 power user get smart meter
2021-06-14,adani group say report freeze foreign fund blatantly erroneous
2021-06-14,adani group say report freeze foreign fund blatantly erroneous
2021-06-14,mumbai 400 adani user opt ‘ green power ’ tariff scheme
2021-06-14,share adani group plunged sharply
2021-06-14,adani share slump freeze placed foreign fund
2021-06-14,sensex nifty fall adani stock weigh cpi data eyed
2021-06-15,large holding three fpis adani co made market jittery
2021-06-15,adani stock tank nsdl freeze account 3 fpis
2021-06-15,adani stock tank nsdl freeze account 3 fpis
2021-06-15,adani stock tank nsdl freeze account 3 fpis
2021-06-15,adani group share close mixed note
2021-06-16,adani stock see mixed reaction
2021-06-16,barred adani investor fret three mauritius fund
2021-06-17,tycoon gautam adani loses 13 billion worst wealth rout
2021-06-18,mystery behind slump adani group company share
2021-06-19,think box punjab adani group told
2021-06-22,company must go green survive mukesh ambani
2021-06-24,adani group begin coal export australia mine year
2021-06-25,adani group strike coal australia charmichael project
2021-06-30,rajasthan hc cancel allotment public utility land pokhran adani firm
2021-07-07,billionaire mukesh ambani gautam adani face race solar domination
2021-07-08,mumbai fracas firm cut power unpaid bill
2021-07-09,gujarat cng sale cross precovid level petrol price soar
2021-07-12,india become 15 trillion economy 2 decade gautam adani
2021-07-12,intergenerational holder equity gautam adani confusion mauritius fund
2021-07-13,adani group take mumbai airport
2021-07-13,adani blame stock crash ‘ reckless ’ reporting
2021-07-13,dozen gujarat company yield 100 return one year
2021-07-14,create thousand local job adani mumbai airport
2021-07-14,mumbai adani consumer opt energy saving discounted new refrigerator
2021-07-14,adani green energy get shareholder nod raise borrowing limit r 25ooo crore
2021-07-17,adani group extends support kabaddi player harmanjeet
2021-07-18,mial veteran r k jain adani group ceo airport
2021-07-18,mumbai adani cut supply r 12cr due
2021-07-19,regulator probing adani group company noncompliance rule say govt
2021-07-20,sebi dri probing adani group co govt tell l
2021-07-20,gujarat ’ second roro service set flag
2021-07-20,mumbai navi mumbai airport headquarters remain mumbai adani group
2021-07-20,communication sebi yet dri matter tribunal adani group
2021-07-20,sebi dri probing adani group company government tell lok sabha
2021-07-20,adani group stock tumble hit lower circuit
2021-07-21,aai committee find adani violation branding logo pact group begin making change
