Date,Title
2014-09-22,cil may reduce coal supply plant feed private plant
2014-09-25,adani coalmine rail project get nod australian government
2014-09-29,premier pundit management bakul dholakia energized iimahmedabad series initiative
2014-09-29,bakul dholakia premier pundit management
2014-09-30,govt cancel sezs hindalco essar adani
2014-10-04,three village get grazing land back apsez
2014-10-10,ambanis adani pledge investment r 1 lakh crore mp
2014-10-24,centre clear 370acre forest land adani ’ power project maharashtra
2014-10-29,bank shun adanis 16 billion australian project
2014-10-30,pccf put adani land diversion hold
2014-11-01,vpt plan strengthen four berth inner harbour
2014-11-03,sc coal verdict cost adani r 6000 crore
2014-11-10,tata adani power may wait longer tariff hike
2014-11-17,adani group australian mine project cleared
2014-11-18,aap question mou adani sbi
2014-11-18,adanis australian project get 1 billion sbi loan
2014-11-20,sbi defends 1 billion loan adani group congress call ‘ crony capitalism ’
2014-11-20,coal auction norm cap tariff tata power adani allowed bid
2014-11-20,sbi lend 1 billion adani group congress question ethic
2014-11-21,net outgo 200m adani loan sbi
2014-11-21,congress question sbi ’ 1 billion loan adani coal mine
2014-11-22,cong may tie jmm poll result
2014-11-23,chetan slam narendra modi environmental policy
2014-11-24,adaniwelspun invest 15 billion u shale canadian oil sand asset
2014-11-24,adaniwelspun invest 15 billion u shale canadian oil sand asset
2014-11-24,jaitley reject congress criticism sbi loan adani
2014-11-25,adani acquire 600mw avantha plant r 4200cr
2014-11-25,business model aligned national interest gautam adani
2014-11-27,lohara reallocation file pmo congress
2014-11-28,tmc question sbi loan adani group
2014-12-04,adani group state bank india defend 1 billion funding plan
2014-12-07,sbi take final call 1 billion loan adani 3 month
2014-12-11,tata power buy plant 3000cr
2014-12-17,adani get nbwl nod tiroda land
2014-12-19,adani downer 2 billion dollar deal
2014-12-20,mormugao mla gun adani official coal pollution
2014-12-26,land plenty bhandara gondia await industry
2014-12-31,worker killed mishap adani plant
2014-12-31,adani terminal mpt get gspcb notice pollution
2015-01-02,abhijeet group power plant sale rs4500cr debt
2015-01-02,adani power give rs16l kin mishap victim
2015-01-02,adani power give rs16l kin mishap victim
2015-01-11,adani sunedison invest r 25000 crore gujarat
2015-01-12,sunedison adani set solar photovoltaic manufacturing facility gujarat
2015-01-18,vasundhara raje visit mundra port
2015-01-29,adani power consolidated ebidta rose r 1793 crore q3fy15
2015-01-30,adani enterprise soar nearly 10 hit 52week high intraday
2015-01-31,adanis demerge port power business
2015-02-03,adani scrip fire add 3 billion market cap january
2015-02-06,calcutta hc order winding abhijeet group company employee ’ due
2015-02-10,adani clinch sweetened 1b udupi power deal
2015-02-10,rajasthan govt adani ink mou solar plant
2015-02-12,adani eye airport foray via ahmedabad
2015-02-13,apl come cpl ’ rescue abhijeet group
2015-02-14,coal block auction begin ambanis adanis race
2015-02-15,coal auction government get 130 technical bid 21 mine
2015-02-18,railway 18 company face probe service tax evasion
2015-02-25,state hold talk vizhinjam project bidder
2015-03-02,adani likely invest 3 sindri project
2015-03-05,coal block auction usha martin adani emerge winner first day round 2
2015-03-11,queensland govt clear adani gvk project australia
2015-03-13,adani plan r 20k crore clean energy park mundra
2015-03-13,sbi chief arundhati bhattacharya scotch report scrapping 1 bn loan pact adani
2015-03-15,adani plan 1000mw solar power plant ramanathapuram
2015-03-21,abhijeet group pay half due prevent liquidation
2015-03-22,msedcl directed allow wardha co sell power
2015-03-24,adani jsw vie monnet power
2015-03-24,centre allocates 17 mega food park state private firm
2015-03-27,cigarette worth crore seized gujarat
2015-03-28,owner reject adanis land deal australia
2015-03-31,australian green lobby drag adani group court mine project
2015-03-31,dri arrest 1 r 24 crore cigarette seizure case
2015-04-04,uberrich buying luxury apartment bandrakurla complex
2015-04-08,pm ’ giveitup call adani group employee vow shun lpg subsidy
2015-04-09,five die cleaning 25deep tank adani ’ oil factory neemuch
2015-04-09,three french bank refuse fund adani project australia
2015-04-09,india inc rally behind pm ’ appeal give gas subsidy
2015-04-14,adani working australia group resolve land issue
2015-04-16,australian bank may still want fund adani ’ disputed coal project
2015-04-17,avantha get ‘ mafia ’ threat adani sale
2015-04-17,mafia threat avantha adani sale two person arrested making extortion call
2015-04-18,corporate head planned extortion bid avantha
2015-04-20,modi govt working poor ambani adani naidu
2015-04-21,adani completes r 6300cr lanco ’ udupi plant deal
2015-04-23,adani ’ tiroda plant tariff go
2015-04-25,adani bidder vizhinjam project
2015-05-12,adani power sink 7 disappointing q4 result
2015-05-14,ioc gail gas deal adani
2015-05-18,adani foray defence manufacturing
2015-05-23,cong leader taunt team modiadani
2015-05-26,jayaswal ’ grounded plane auctioned
2015-05-26,make india adani group may foray defence manufacturing mundra
2015-05-31,adani hire mba grad denied job muslim
2015-06-02,congress question adani group operating rajasthan govts coal mine chhattisgarh
2015-06-03,cong raise finger adani ’ rajasthan coal mining operation
2015-06-03,sena pat back adani group hiring muslim mba
2015-06-04,gadkari warning force chandy back adani bid
2015-06-04,maoist oppose adani group coal project australia support struggle indigenous group
2015-06-06,reliance power adani 45 billion power play bangladesh
2015-06-07,reliance power adani 45bn power play bangladesh
2015-06-09,adani company raise r 25000 crore via bond
2015-06-11,adani port begin work vizhinjam nov 1
2015-06-17,oustees take back land given adani group patkar
2015-06-24,44 firm ignored job quota rule
2015-06-24,went 4 pm 18 foreign visit adani
2015-06-25,adani may junk 16bn oz project
2015-06-25,adani set solar project jaisalmer
2015-06-28,gulf kutch gateway india inc
2015-06-28,gulfbased gfh sign pact adani mumbai economic zone
2015-06-29,adani suspends au project engg work delay approval
2015-06-30,tn government adani likely sign solar deal today
2015-07-07,iocadani combine bid cng licence 5 city
2015-07-10,lack demand close ntpc mouda plant
2015-07-15,adani talk acquire gangavaram port 21b
2015-07-15,adani accepts letter award
2015-07-18,tamil nadu ’ adani deal scanner
2015-07-18,mp solar tariff put tn adani deal scanner
2015-07-20,tamilisai seek report tamil nadus power deal adani group
2015-07-20,adani representative meet cm
2015-07-20,vizhinjam port kerala govt adanis ink pact august 17
2015-07-20,mp solar tariff put tn adani deal scanner
2015-07-21,medical school fee rise 40 3 year
2015-07-22,adani suspends 2 key contractor biggest australia coal project
2015-07-23,adani port raise 650 million via dollar bond issue
2015-08-05,australian court revoke approval adanis coal mine project
2015-08-06,snake lizard threaten adanis 16bn oz coal mine project
2015-08-06,blow adani australia bank end adviser role
2015-08-07,australian pm back adani mine say sabotaging project dangerous
2015-08-08,australian pm tony abbott attack proadani statement
2015-08-16,vizhinjam port mou signed monday
2015-08-18,adani ink port pact kerala
2015-08-18,v receives adanis stand firm stated position
2015-08-18,adani set 1000day deadline vizhinjam
2015-08-24,adani enterprise invest r 25000 crore chhattisgarh
2015-08-25,govt sign mous worth rs25k crore adani develop 2 project
2015-09-03,centre build major port tamil nadu cost r 21000 crore
2015-09-03,adani loses key customer carmichael mine australia
2015-09-03,hc cite lack proof decline entertain plea adani group
2015-09-06,hp govt approves refund 280 cr adani power
2015-09-06,himachal refund r 280 crore adani power
2015-09-11,adani bail power crisis
2015-09-11,adani group expand capacity udupi power plant 1600mw
2015-10-03,aiadmk govt shelving portmaduravoyal elevated expressway project chennai facilitate adanis dmk chief karunanidh
2015-10-03,adani port lt ink pact manage kattupalli port
2015-10-04,adani group take port near chennai
2015-10-05,left alternative say prakash karat
2015-10-06,adani eye sindri fertilizer factory
2015-10-09,shed procorporate tag venkaiah naidu say adani ambani cong ’ meherbani
2015-10-15,adanis coal mine project get reapproval australia
2015-11-02,power tariff jat quota focus inld rally
2015-12-04,24 year kerala begin work vizhinjam port
2015-12-06,vizhinjam adani announces csr project worth 35cr
2015-12-06,adani port keen enter maharashtra ap karnataka foreign nation
2015-12-21,adani power share zoom 9
2015-12-23,adani gain oz clear expansion key port
2015-12-28,karan adani take ceo adani port sez
2015-12-29,karan adani take port sez ceo
2015-12-29,karan adani take port sez ceo
2016-01-07,adani build transshipment hub mundra
2016-01-09,adani upcl release csr grant r 374 crore yellur gram panchayat
2016-01-10,adani upcl offer r 463cr csr mudarangadi gp
2016-01-11,rally adani power plant today
2016-01-11,rally adani power plant today
2016-01-12,adani drop anchor ap
2016-01-17,ngt quashes green nod adani hazira port
2016-01-17,ngt quashes green nod adani hazira port
2016-01-25,yet another delay hit city gas project
2016-01-26,former australian mp set 4600 km marathon run
2016-01-27,adani power azure power win solar project bid uttar pradesh
2016-02-02,adanis coal project australia get environmental approval
2016-02-04,adani eye power plant state
2016-02-06,plot cng station cancelled
2016-02-07,parineeti chopra unveils india ’ first diabetes care oil mumbai
2016-02-08,adani eye solar plant australia coal plan remains stuck
2016-02-08,adani eye solar plant oz coal plan remains stuck
2016-02-09,adani eye solar plant australia
2016-02-10,australia govt booster adani coal project
2016-02-11,adani ’ coal project get oz govt boost
2016-02-23,promoter sunil mittal kansai paint others go fishing stock sink new low
2016-02-27,adani group gag advocate
2016-02-27,adani enterprise new arm coal washing biz
2016-03-01,centre nod clubbing adani 3 sezs gujarat
2016-03-03,ngt penalty adani deposit r 25 cr fine
2016-03-04,ngt penalty adani deposit r 25 cr fine
2016-03-04,adani group may buy jindal power
2016-03-04,ngt penalty adani deposit r 25 cr fine
2016-03-04,gadkari point dip adani port business blunt opposition attack
2016-03-04,adani group may buy jindal power
2016-03-17,mp govt remove land encroachment adaniwilmar
2016-03-18,power plant conspiracy govt benefit adani ambani
2016-03-27,adani offer 49 pc stake dhamra lng project ioc gail
2016-03-29,sp fitch assign stable outlook adani transmission
2016-03-30,adani tie elbit alpha unmanned aircraft system
2016-04-03,adani gas cut png cng price
2016-04-04,adani enterpris share surge 8 win australia mining lease
2016-04-05,deliberate attempt draw adanis name panama paper
2016-04-07,adani restart talk stakeholder australian mine project
2016-04-08,adani defence business ally joint venture panamahit italian company
2016-04-12,inox wind bag two 70mw wind energy projs adani green
2016-04-17,adani get land owner consent oz project
2016-04-20,firm failing impact india solar plan goyal
2016-04-21,one dead 20 hurt hot water pipe burst adani plant
2016-04-29,7 succumb burn injury sustained adani plant
2016-04-30,7 succumb burn injury sustained adani plant
2016-05-03,adani power q4 net jump 64 r 1173 cr
2016-05-03,adani port q4 net profit jump 38 r 914 crore
2016-05-04,adani enterprise report q4 net profit r 167 cr
2016-05-04,adani port slump 12 mcap r 5849 crore
2016-05-05,water tiroda power plant released
2016-05-06,water supply adani plant still uncertain
2016-05-06,water supply adani plant still uncertain
2016-05-06,water supply adani plant still uncertain
2016-05-09,godda villager keep adani farmland
2016-05-09,aggregate debt top corporates well within norm sbi
2016-05-12,tariff relief 2 adani group power project
2016-05-12,aptel disallows compensatory tariff adani group plant
2016-05-12,aptel disallows compensatory tariff adani group plant
2016-05-13,bengal get hc nod bigticket mining operation
2016-05-13,water shortage may shut adani ’ tiroda plant later month
2016-05-17,lack water nearly shuts adani plant tiroda
2016-05-19,iocadani gail fail reach price agreement
2016-05-26,essar move hc govt gmb
2016-05-26,adani power expansion mundra hit green hurdle
2016-05-26,gail reconfigures r 12000 cr jagdishpurhaldia gas pipeline
2016-05-31,adani wilmar ruchi soya ink consumer good jv
2016-06-03,rio game u stint boost shot putter inderjeet singh
2016-06-03,public funding adanis coal mine australia pm
2016-06-08,abb open global business service centre bengaluru
2016-06-08,abb open glopal business service centre bengaluru
2016-06-09,fci ink pact adani group construction 2 silo
2016-06-09,coal power sector india water guzzler greenpeace
2016-06-09,coal power sector india water guzzler greenpeace
2016-06-13,abb link 648 mw solar project kamuthi national grid
2016-06-24,mahagenco ’ high rate causing power tariff hike
2016-06-27,sensex stay flat worst fall four month
2016-06-28,sensex stay flat worst fall four month
2016-06-28,bankrupt sun edison indian asset sale kick
2016-06-29,adani eye financial service tie macquarie nbfc
2016-07-01,vigilance probe official misused power graft case
2016-07-01,vigilance probe official misused power graft case
2016-07-01,adani proposes expand kattupalli port
2016-07-01,adani proposes expand kattupalli port
2016-07-01,gmr energy offloads stake adani transmission r 100 cr
2016-07-02,gmr energy offloads stake adani transmission r 100 cr
2016-07-02,vigilance probe official misused power graft case
2016-07-02,gmr energy offloads stake adani transmission r 100 cr
2016-07-04,cong raise mundra port issue parliament
2016-07-04,10 ew quota violates constitution sc order gujarat hc told
2016-07-05,summary observation recorded 0830 hr ist
2016-07-05,ministry expansion drama poll mayawati
2016-07-06,modi cabinet rejig drama say mayawati
2016-07-08,jharkhand aim power hub 2019 da
2016-07-09,pulse import benefit adani group say jdu
2016-07-09,mozambique pact pulse benefit adani group jdu
2016-07-09,mozambique pact pulse benefit adani group jdu
2016-07-09,pulse import benefit adani group say jdu
2016-07-11,political party unnecessarily drag corporates politics gautam adani
2016-07-11,sensex race 11mth high global cue nifty 8400
2016-07-12,jairam ramesh say gautam adani beneficiary crony capitalism
2016-07-15,sc refuse stall cerc proceeding compensatory tariff
2016-07-15,hardik walk jail vow continue quota stir
2016-07-15,kerala take colachel issue pm
2016-07-17,msedcl pay 16000 crore power never need
2016-07-19,fitch maintains stable outlook adani port
2016-07-19,fitch maintains stable outlook adani port
2016-07-20,adani enterprise raise r 6000 crore via security
2016-07-20,adani port complete terminal expansion mundra next year
2016-07-29,adanis medical college move hc management quota surrendered
2016-08-05,market hit higher orbit boe action sensex zoom 364 pt
2016-08-05,govt using 80 consumer money show power subsidy aap
2016-08-05,sensex zoom 364 pt nifty top 8600 boe stimulus push
2016-08-08,odisha seek cancellation tentuloi coal block otpcl
2016-08-08,bofaml expects rajan cut rate 25 bps tomorrow
2016-08-08,swamy prasad maurya join bjp
2016-08-08,govt never imposed penalty r 200 cr adani port sez
2016-08-09,apsez q1 net 31 r 836 cr
2016-08-09,irom sharmila get bail yet end fast
2016-08-09,adani power net loss narrow r 34 cr aprjun qtr
2016-08-10,poll 3 expelled cong mlas join bsp
2016-08-10,adani port share jump nearly 8 mcap rise r 3935 cr
2016-08-10,sensex post biggest singleday fall 6 week tank 310 pt
2016-08-10,adani enterprise q1 net profit flat r 364 cr
2016-08-10,travelyaari raise 7 mn gvfl bccl
2016-08-10,preparation afoot krishna pushkaram commencing friday
2016-08-10,adani transmission q1 net profit jump 3fold r 123 cr
2016-08-28,gmrs massive debt fail rankle goa government
2016-09-02,ngt refuse quash green nod adanis kerala port project
2016-09-04,gujarat cm inaugurates 5th edition toiadani shantigram t20 soccer
2016-09-09,birla mahindra among top biz honcho attend gi
2016-09-12,sensex trim early loss still 399 pt late morning
2016-09-13,aap expects dirt till goa punjab poll
2016-09-13,adani essar get dri notice overvaluing import
2016-09-14,sensex trade tight range bank auto save day
2016-09-21,merger quick fix banking sector issue assocham
2016-09-21,iocgail take 49 stake adani group dhamra lng project
2016-09-21,walmart india evaluating foodonly retail model
2016-09-21,adani group launch world ’ largest solar power plant tamil nadu
2016-09-21,railway functional autonomy bear salary burden
2016-09-21,kalyan jeweller invest r 900 cr expansion
2016-09-22,ioc gail mou dharma lng terminal
2016-09-25,india inc generationnext leader join crorepati club
2016-09-25,government port chief visit adanis mundhra port learn best practice
2016-09-25,adani upcl earmark r 536 cr csr
2016-09-26,sensex slide 149 point banking drag
2016-09-27,number chronically stressed company rise credit suisse
2016-09-27,sensex fails latch gain slump europe woe
2016-09-27,nifty decline third day slip 17 point
2016-09-29,speeding truck crash house injures woman
2016-10-01,35 lakh solatium marayamuttom accident
2016-10-04,sensex climb 159 point rbi policy meet focus
2016-10-05,adani sole bidder bhavanapadu port
2016-10-05,adani sole bidder bhavanapadu port
2016-10-05,photocopy casepublishers appeal delhi hc judgement
2016-10-05,rinfra sell power transmission biz adani r 2k cr
2016-10-05,rinfra sell power transmission biz adani r 2k cr
2016-10-05,hardly make film child bollywood ketan mehta
2016-10-06,rinfra sell power asset adani
2016-10-06,cary fukunaga visit india mami
2016-10-06,govt considering ban celebrity misleading ad
2016-10-06,sp moody rating atl unaffected rinfra deal
2016-10-07,fire near gas station char 3 vehicle vadaj
2016-10-12,adani upcl develops village road
2016-10-13,teacher ’ protest ‘ fast ’ today may remain mumbai affair
2016-10-17,foul play ruled adani power vicepresidents suicide cop probe case
2016-10-17,adani power vp commits suicide jaipur hotel
2016-10-19,update knowledge engineer vnit sign mous adani zeus
2016-10-22,foreign funded group want stop adani project au report
2016-10-24,cag call vizhinjam agreement onesided
2016-10-29,98 tree special zone likely cut
2016-11-01,adani upcls road inaugurated santhuru village 2510 lakh spent
2016-11-06,sukhbir harsimrat badal start 100 mw hsat plant
2016-11-09,bathinda get 100mw solar plant
2016-11-09,sensex nifty sink possible trump win withdrawal r 500 r 1000 note
2016-11-12,chandigarh get first cng station sector 44
2016-11-14,iimi utsaha
2016-11-15,ioagpl snap png supply medical college
2016-11-18,commercial consumer rethink moving png
2016-11-22,11000 ngo may get another chance renew fcra licence
2016-12-06,adani start work australia mine mid2017
2016-12-08,adani slammed low quality edible oil sale
2016-12-16,gujarat cm inaugurates vibrant ceramic expo summit2016 ahmedabad
2016-12-17,adani group developing ceramic cluster mundra
2016-12-17,adani group developing ceramic cluster mundra
2016-12-22,odisha clear investment proposal worth r 3000 crore
2016-12-22,first cng station open sangam city
2016-12-24,bjp reel document accuse upa favouring big corporates
2017-01-08,vibrant gujarat summit r 1 lakh crore fuel fire renewable energy
2017-01-09,vibrant gujarat global summit making mountain
2017-01-11,home turf pm narendra modi make reform pitch woo global business leader
2017-01-12,vibrant gujarat summit 24000 mous worth r 20 lakh crore signed day two
2017-01-13,state centre clear flyover proposal fast
2017-01-22,fire damage corporate office navrangpura
2017-01-23,major fire navrangpura office
2017-01-25,tata steel buy 51 odisha port project
2017-01-31,hyundai motor tiesup pusa institute technology
2017-02-03,refreshing approach growth via prudent measure adani
2017-02-08,godda villager seek halt land takeover adanis
2017-02-09,fitch assigns bbb rating adani port usd 500 mn bond
2017-02-09,rate hope spur budget rally sensex soar 4month high
2017-02-10,gi giant step towards povertyfree jharkhand raghubar da
2017-02-11,fresh bid tamil nadu inch max solar power limit
2017-02-18,govt yet approve revenue share bhavanapadu port
2017-02-20,adani transmission q3 net profit 33 r 9928 cr
2017-02-20,sensex end higher choppy trade eye iip data
2017-02-20,rinfra q3 net 49 r 375 creyes r 2l cr opportunity
2017-02-20,punj lloyd win r 348 crore pipeline tankage contract
2017-02-21,epca plan ban dirty fuel gas firm ready alternative supply
2017-02-22,correctedtableindia commercial paper dealtfeb 22
2017-02-22,breakingviewslloyds latest target look bridge far
2017-02-23,rpttableindia commercial paper dealtfeb 22
2017-02-23,rpttableindia commercial paper dealtfeb 22
2017-02-23,asia fuel oil tenderbahrains bapco offer midmarch hsfo cargo
2017-02-25,wanted see lawyer –this party
2017-02-26,wind power project go hammer next fiscal
2017-03-01,indian firm raise usd 182 bn overseas market jan
2017-03-01,hc stay apsez ’ notice cwc
2017-03-01,unit4 mundra plant run record 600 day adani power
2017-03-02,sensex fails keep early lead 145 pt late selloff
2017-03-02,market change course sensex give 145 pt
2017-03-06,violence erupts godda gram sabha several injured
2017-03-06,adani group seek another 142ha forest land near nagzira
2017-03-07,public meet end majority give nod power project
2017-03-10,jvmp alleges foul play godda public meet
2017-03-12,owner go green neighbourhood ’ pride
2017-03-17,queensland govt support usd 165bn coal mine project adani
2017-03-17,mock drill near adani port hajira
2017-03-17,mock drill near adani port hajira
2017-03-17,kochi 100 connection bengaluru 2000
2017-03-21,shetty slam sbi chief farmer ’ debt waiver remark
2017-03-21,142ha forest land near nagzira adani plant
2017-03-26,aii purdue university collaborate
2017-03-26,aii purdue university collaborate
2017-03-31,shah panel trash graft charge guj govt modi
2017-04-01,sreenivasan athirappilly project help middleman make money
2017-04-01,government pump money get meagre return psus
2017-04-05,adanis coal mine project australia granted water licence
2017-04-07,inquiry likely private firm
2017-04-12,navrachana university felicitates school ‘ swachhagrah ’ project
2017-04-12,supreme court set aside power tariff order tribunal
2017-04-15,500 gain skill devpt centre tiroda
2017-04-17,poultry business brother strike oil grit
2017-04-18,jvmp protest adani land
2017-04-19,sensex back green imd forecast hold hope
2017-04-19,ap government want revenue share bhavanapadu port
2017-04-26,city gas project local body spot go
2017-04-27,woman trainee pilot instructor dead plane hit high tension wire
2017-04-29,iran offer india run phase one chabahar port
2017-04-30,brinda karat take dig bjp ‘ double speak ’ kashmir
2017-05-03,adani group meet godda land donor
2017-05-04,jvmp plan statewide agitation
2017-05-05,mkts rollsensex soar 189 pt reform earnings boost
2017-05-08,kamarajar portadani group terminal ready 1 month
2017-05-09,power plant flout norm ’ transport flyash
2017-05-11,adani power limited halt 1250mw supply guvnl
2017-05-12,adani power cut 1250 mw power supply guvnl
2017-05-12,mla fear threat life government
2017-05-17,adani power share jump nearly 9 buzz cerc relief
2017-05-19,sac ink mou adani group optimize solar power generation
2017-05-22,unhappy diluted state rera homebuyers seek divine intervention
2017-05-22,adani begin extracting coal australian project fy21
2017-05-23,sensex 85 point early trade profit booking
2017-05-24,vizhinjam project favour adani say cag report
2017-05-26,market continue surge sensex nifty reach alltime high
2017-05-30,adani australian coal project back track royalty deal
2017-05-31,adani oz coal project back track royalty deal
2017-06-01,sensex nifty end flat guard volatility gdp number
2017-06-04,cm oommen chandy competitor keen see vizhinjam project nixed
2017-06-07,‘ panel probe matter ’
2017-06-09,contractor ’ men seek adani gas job
2017-06-12,vizhinjam deal report oommen chandy writes cag
2017-06-14,flying high coming thud
2017-06-19,fitch rate adani port proposed usd note bbbexp
2017-06-19,corp nbfcs look steer lending boom
2017-06-19,moody revise adani port outlook stable negative
2017-06-20,blocking creek near mundra human right commission seek report fisherman plaint
2017-06-21,petronet talk buy stake gspc mundra lng terminal
2017-06-22,tata power offer sell 51 stake mundra 1
2017-06-27,sensex nifty open strong long weekend
2017-06-27,govt stitch rescue plan tata adani power plant
2017-06-29,mep collect toll rajiv gandhi sea link
2017-06-29,cong ncp ask govt clarify stand land bill
2017-06-29,india solar power capacity 22 gw march goyal
2017-06-29,government approve fdi proposal 810 week
2017-06-29,guvnl vet proposal take importedcoal power plant
2017-07-04,sensex nifty gain 1 feelgood rally
2017-07-10,gujarat meet today rescue plan power plant
2017-07-11,plan invest white elephant chimanbhai sapariya
